{"created_at":"2026-10-07T05:09:25.077Z","entries":[{"artifact_class":"deployment_assembly_inventory","artifact_path":"admission/deployment-assembly.inventory.json","bytes":1821,"derivation":"primary","sha256":"53d14f26d7605011bea34639fede0e3f972094779c581e1b08037a558202bc0d"},{"artifact_class":"deployment_assembly_file","artifact_path":"admission/deployment-assembly/SucRua-validation-a8a5b2f1.assets.json","bytes":2859,"derivation":"primary","sha256":"4e636317e9c75353678603deffd2e5127fba4212d3399a3a043420c8e4e32dff"},{"artifact_class":"deployment_assembly_file","artifact_path":"admission/deployment-assembly/SucRua-validation-a8a5b2f1.metadata.json","bytes":41762,"derivation":"primary","sha256":"d1faf0bd0f72150f6fbc317e55fd64662e1b3e22c1ae73ed88a09c85a31bba66"},{"artifact_class":"deployment_assembly_file","artifact_path":"admission/deployment-assembly/SucRua-validation-a8a5b2f1.template.json","bytes":31589,"derivation":"primary","sha256":"aa69e88bfdad1b0cc281df26c51e47b5b1b0b398cadaa774d508f0d761898bf4"},{"artifact_class":"deployment_assembly_file","artifact_path":"admission/deployment-assembly/asset.8410ea2a4b0a127a75b4c7d88053a05bc57f5498efe0f8f6b61b945175407c2e/index.mjs","bytes":908510,"derivation":"primary","sha256":"905689cb997315013c96c3b6f88879bddad8a9abfb94d42026e79f84e9f6175d"},{"artifact_class":"deployment_assembly_file","artifact_path":"admission/deployment-assembly/asset.ad333b8c875a2537a0e759b35416f794d15aa6e73a4f1c1a13dba83b8cb1fe61/index.mjs","bytes":1095221,"derivation":"primary","sha256":"b4b9125056c132b901370c9ad0043c8dda79ea4770930bab9a6508bdaf511b45"},{"artifact_class":"deployment_assembly_file","artifact_path":"admission/deployment-assembly/asset.b36173153d6d06172effcbcc31fc010e03eb53848e6a79a3aa73b2c555ae2477/index.mjs","bytes":931650,"derivation":"primary","sha256":"ad372a42fa9dc225854398a23c7aa61604c9891ff830713a10a4a39fa130b663"},{"artifact_class":"deployment_assembly_file","artifact_path":"admission/deployment-assembly/cdk.out","bytes":20,"derivation":"primary","sha256":"2801c31b9ddf660f597e3c9d9ba2a9505ac144717ede055f34dc916602a35b25"},{"artifact_class":"deployment_assembly_file","artifact_path":"admission/deployment-assembly/manifest.json","bytes":27774,"derivation":"primary","sha256":"ea5e4a3a239654d7cc9a00dbc17436a714188fc77951b08242432bea045a8523"},{"artifact_class":"deployment_assembly_file","artifact_path":"admission/deployment-assembly/tree.json","bytes":35649,"derivation":"primary","sha256":"6594aac564ce0adaae51138032558fe0e79ccee9d5139fed8d43d917085238ed"},{"artifact_class":"deployment_assembly_file","artifact_path":"admission/deployment-assembly/validation-report.json","bytes":80,"derivation":"primary","sha256":"ba990d19514a4d3818b0d9e46e6662257238d206389b9aa4ada378f1d1fb00c6"},{"artifact_class":"environment_input","artifact_path":"admission/environment-input.json","bytes":396,"derivation":"primary","sha256":"166e47e3a3bf75958f795a2c3b4a09f0d29dfadfd8c731a1cd90ecb166f3097f"},{"artifact_class":"execution_manifest","artifact_path":"admission/execution-manifest.json","bytes":19527,"derivation":"primary","sha256":"5459474242d205254c43b902dc31625e8ad7681fb9dafcba08a53ee38be92fec"},{"artifact_class":"oracle_revision_check","artifact_path":"admission/oracle-revision-check.json","bytes":9208,"derivation":"primary","sha256":"991dfd60d3afb7bc28898e946199f025df0318ee4412af2d7d140dcfdd2ae993"},{"artifact_class":"preflight_journal","artifact_path":"admission/preflight-journal.jsonl","bytes":6504,"derivation":"primary","sha256":"9bab46d51fe0d053f952062a1c473ec654c913ed58da1f13412b02ca5bfc6a4b"},{"artifact_class":"schema_file","artifact_path":"admission/schemas/group-a/admission_rejection.schema.json","bytes":1605,"derivation":"primary","sha256":"e68e24aa51b168310919cb17493579a0a1c2520587dc557542470e9ca949ea01"},{"artifact_class":"schema_file","artifact_path":"admission/schemas/group-a/approved_decision.schema.json","bytes":1109,"derivation":"primary","sha256":"f0c643471b25ca18a9c2585bd66009a2e623c3c8717e852e31c241ba82d8665b"},{"artifact_class":"schema_file","artifact_path":"admission/schemas/group-a/deployment_assembly_inventory.schema.json","bytes":2108,"derivation":"primary","sha256":"39cffc6841b8ded6daf39d57d9ae832cab21812085a2afe6e6cb0427e63b5c1a"},{"artifact_class":"schema_file","artifact_path":"admission/schemas/group-a/environment_input.schema.json","bytes":1653,"derivation":"primary","sha256":"65f7e80ead606df9bda4b2d6e4af2b34b06daf030bcd1900f448965ba517f9e8"},{"artifact_class":"schema_file","artifact_path":"admission/schemas/group-a/execution_manifest.schema.json","bytes":17022,"derivation":"primary","sha256":"43f48f6b04049860729d356432f2f12664a14c732d115106ed7cb6bb126d764c"},{"artifact_class":"schema_file","artifact_path":"admission/schemas/group-a/payment.schema.json","bytes":860,"derivation":"primary","sha256":"1e4e803efd209f0b3ca11bc90816b44e83559075bf4754fc9f59468109a7b59f"},{"artifact_class":"schema_file","artifact_path":"admission/schemas/group-a/preflight_check_recorded.schema.json","bytes":7113,"derivation":"primary","sha256":"11c945d4fad78bdc3ee801ac138ebbd57f5d7a01f6ac2e5f07322c54e2335365"},{"artifact_class":"schema_file","artifact_path":"admission/schemas/group-a/probe_workload_request.schema.json","bytes":1313,"derivation":"primary","sha256":"9be488b4a3d64561674c95968536710aa98779220cfd8cbad9de172f865ffcdb"},{"artifact_class":"schema_file","artifact_path":"admission/schemas/group-a/provider_execution_configuration.schema.json","bytes":2907,"derivation":"primary","sha256":"bf3f28329a6a2a2ea350364a52a3140cef2399aa6125fff8f8cde3c51f2f43aa"},{"artifact_class":"schema_file","artifact_path":"admission/schemas/group-a/provider_refund_call.schema.json","bytes":3220,"derivation":"primary","sha256":"110a3d84ea1f04fc691f804e5ce3eea26fb81210d5ede3657f449708a2321585"},{"artifact_class":"schema_file","artifact_path":"admission/schemas/group-a/provider_refund_response.schema.json","bytes":2478,"derivation":"primary","sha256":"7913a0bf66cde5e97eec6b47626b2821a570194c24d7e00f1d6b048ef6099747"},{"artifact_class":"schema_file","artifact_path":"admission/schemas/group-a/provider_trial_configuration.schema.json","bytes":3363,"derivation":"primary","sha256":"fc1b51ffc07632969c197559f63edf1f1de94843047eb6fe9e5f515d558bd0cb"},{"artifact_class":"schema_file","artifact_path":"admission/schemas/group-a/resource_manifest.schema.json","bytes":9006,"derivation":"primary","sha256":"91610780f92f561ef052ea233e23e8f5013d181a35a1f22b630135764679be88"},{"artifact_class":"schema_file","artifact_path":"admission/schemas/group-a/source_provenance.schema.json","bytes":2219,"derivation":"primary","sha256":"d20585a80567d46d2d958df19ca94771342eccfd214be66516613eaf5453449b"},{"artifact_class":"schema_file","artifact_path":"admission/schemas/group-a/transport_scope_policy.schema.json","bytes":2397,"derivation":"primary","sha256":"447ffeabe8ac03fe93139c728c0c1376c8fdc23e4f41080182ebefec9e6172d2"},{"artifact_class":"schema_file","artifact_path":"admission/schemas/group-a/transport_scope_snapshot.schema.json","bytes":7076,"derivation":"primary","sha256":"74f4423d81106338ea931d4130531b79a4400397d63f9d2f18738e0ac8e36538"},{"artifact_class":"schema_file","artifact_path":"admission/schemas/group-a/trial_manifest.schema.json","bytes":4258,"derivation":"primary","sha256":"0d90b2014550d9f835a4d26cad21cd74c9367148167372fde43cb5c7f3510be7"},{"artifact_class":"schema_file","artifact_path":"admission/schemas/group-a/trial_message.schema.json","bytes":1501,"derivation":"primary","sha256":"a77312789a66f74bcaade008b5a5bf22441795b8f8578a4739658ccac285a4ee"},{"artifact_class":"schema_file","artifact_path":"admission/schemas/group-a/trial_registration.schema.json","bytes":1912,"derivation":"primary","sha256":"404a960e4be735922800a779464d94784d08dd068d4678a824a9a122138ece0f"},{"artifact_class":"schema_file","artifact_path":"admission/schemas/group-b/attempt_not_dispatched.schema.json","bytes":1879,"derivation":"primary","sha256":"47f3160dd3a81721f5c8014c59d7321b20a2ab17ca54464fafff4680b7b59ad1"},{"artifact_class":"schema_file","artifact_path":"admission/schemas/group-b/attempt_outcome_recorded.schema.json","bytes":7809,"derivation":"primary","sha256":"f2246307a4b40528575e93238de74bedf7e4ed2fbdb5130c9922509c468d41fe"},{"artifact_class":"schema_file","artifact_path":"admission/schemas/group-b/attempt_registered.schema.json","bytes":2000,"derivation":"primary","sha256":"d00bacde25f719095cd7e5ad2ce077c82df178ef09619731a2b81248aecfb9a7"},{"artifact_class":"schema_file","artifact_path":"admission/schemas/group-b/caller_invocation_started.schema.json","bytes":3005,"derivation":"primary","sha256":"256e029fd8b6f952aa331db042d963c1ffb09f0d0cc5a421284795814228ec43"},{"artifact_class":"schema_file","artifact_path":"admission/schemas/group-b/caller_timeout_recorded.schema.json","bytes":3166,"derivation":"primary","sha256":"a5e947ee1c24ee88c43bc254dec0c91b9a8763d1be544f6f32be4fc870ad8987"},{"artifact_class":"schema_file","artifact_path":"admission/schemas/group-b/caller_timeout_rejected.schema.json","bytes":3125,"derivation":"primary","sha256":"0c29ce08049817733ea075c35411d3fe9efa694b4a63342cb6f7e51ded4dfa1f"},{"artifact_class":"schema_file","artifact_path":"admission/schemas/group-b/cleanup_action_recorded.schema.json","bytes":2362,"derivation":"primary","sha256":"64f9c0159030928e2ac7e4565ccd038a3b0442c1191ebe14391880140bd2b652"},{"artifact_class":"schema_file","artifact_path":"admission/schemas/group-b/controller_canary_acknowledged.schema.json","bytes":1331,"derivation":"primary","sha256":"a5e1bb1dfce2fcaf01dab6508472e5ab9643926e8ca655f0784873113173d887"},{"artifact_class":"schema_file","artifact_path":"admission/schemas/group-b/coordination_prefix_checkpoint.schema.json","bytes":1795,"derivation":"primary","sha256":"30a870981a6f733fe6ec90de6336b2b7efb56ee90575dcf11c8995c0cfa5bea7"},{"artifact_class":"schema_file","artifact_path":"admission/schemas/group-b/dispatch_started.schema.json","bytes":1929,"derivation":"primary","sha256":"60f62086dc